{
  "slug": "fr-pakhomius-marcos",
  "kind": "person",
  "name_ar": "القس باخوميوس القمص مرقص جبرة",
  "name_en": "Fr. Pakhomius Marcos",
  "bio_ar": null,
  "bio_en": null,
  "birth_year": null,
  "death_year": null,
  "portrait": null,
  "portrait_source": null,
  "portrait_status": null,
  "wikipedia_ar": null,
  "wikipedia_en": null,
  "aliases_to": null
}
