{
  "slug": "anba-raphael",
  "kind": "person",
  "name_ar": "الأنبا رافائيل الأسقف العام لكنائس وسط القاهرة",
  "name_en": "H.G. Bishop Raphael",
  "bio_ar": null,
  "bio_en": null,
  "birth_year": null,
  "death_year": null,
  "portrait": null,
  "portrait_source": null,
  "portrait_status": null,
  "wikipedia_ar": null,
  "wikipedia_en": null,
  "aliases_to": null
}
