{
  "slug": "roshdi-wasef-bahman-dous",
  "kind": "person",
  "name_ar": "رشدي واصف بهمان دوس",
  "name_en": "Roshdi Wasef Bahman Dous",
  "bio_ar": null,
  "bio_en": null,
  "birth_year": null,
  "death_year": null,
  "portrait": null,
  "portrait_source": null,
  "portrait_status": null,
  "wikipedia_ar": null,
  "wikipedia_en": null,
  "aliases_to": null
}
