{
  "slug": "lyrics",
  "kind": "collection",
  "name_ar": "ألحان وأناشيد",
  "name_en": "Hymns & Lyrics",
  "bio_ar": null,
  "bio_en": null,
  "birth_year": null,
  "death_year": null,
  "portrait": null,
  "portrait_source": null,
  "portrait_status": "n/a",
  "wikipedia_ar": null,
  "wikipedia_en": null,
  "aliases_to": null
}
